title,score,id,url,comms_num,created,body
True bro’s never die,69520,ep11ax,https://i.redd.it/6jp2e2ztexa41.jpg,326,1579115789,
And he did.,46949,e1d8on,https://i.redd.it/3x0vla0eos041.png,530,1574700072,
Legit never used it outside of D&D,44954,f9x1jt,https://i.redd.it/1gy92iks2bj41.jpg,614,1582768023,
same urge here,44129,g0lljo,https://i.redd.it/vxhrxiidxls41.png,386,1586822016,
lol,42553,e9h9iu,https://i.redd.it/idgkdtpl34441.jpg,915,1576145824,
Still less dice than your average DM,42177,fcwwbf,https://i.redd.it/a92x6xm1ghk41.jpg,493,1583280967,
"Players: ""Wow, you really did prep for everything.""",42075,f19l93,https://i.redd.it/8mmhwkxsvwf41.jpg,463,1581288658,
Who made this masterpiece?,41233,c605aq,https://i.imgur.com/F3LjAHa.gifv,466,1561633327,
Still got that potion from the first dungeon,41194,ej3uff,https://i.redd.it/9czf419qef841.jpg,562,1578026159,
How to win at DnD,39311,ev6crx,https://i.redd.it/d1dqyld56jd41.jpg,571,1580250933,
How a Lawful Neutral character steals money,39149,cq9fun,https://i.imgur.com/dsdtz07.gifv,208,1565816934,
Spoiler: his wife is an Artificer,39023,eaz6kp,https://i.redd.it/v5j3q4tpys441.jpg,113,1576446853,
This....hurts,38811,e21cgo,https://i.redd.it/92rwdx84h2141.jpg,300,1574818612,
"Ah, the duality of man",38573,fx6qy5,https://i.redd.it/6tee9od8mlr41.jpg,352,1586382415,
"France does not exist, so it can't be a bad French accent.",38213,fltbie,https://i.redd.it/temoyt6s9tn41.png,377,1584731761,
I'm so proud guys,37793,fj7jps,https://i.redd.it/mfsjuhut7wm41.png,322,1584331513,
Mythbusters? Never heard of 'em (u/dalek7of9),37561,f90n5n,https://i.redd.it/gy4yquvpkyi41.png,193,1582616660,
Dumb Dumb Mister,37242,co7nnd,https://i.redd.it/gurjvnwabhf31.jpg,263,1565409602,
Every time,35663,fi5dlw,https://i.redd.it/5ufywpqoshm41.jpg,195,1584156920,
SEEMS,35315,fs084f,https://i.redd.it/33j4wyjrtvp41.jpg,278,1585634318,
I’m not good at titles,34909,fr7d4i,https://i.redd.it/46d0h0anomp41.jpg,143,1585523634,
"AH SHIT, HERE WE GO AGAIN",34375,e3uqfx,https://i.redd.it/1zumm12u2t141.jpg,293,1575140694,
It's important to discuss these things in session 0,34131,cxhpf3,https://i.redd.it/3phz2hfcjlj31.jpg,237,1567204184,
I forsee a meme,34112,dy2t8g,https://i.redd.it/7k17w0nbzfz31.jpg,328,1574110427,
Seriously though,34093,ga7lp1,https://i.redd.it/kyziil1nqqv41.jpg,1463,1588187892,
